{
  "version": "2.0.0",
  "generatedAt": "2026-09-03T00:00:00Z",
  "disclaimer": {
    "en": "Reference only; verify with the official gazette/order or your DDO.",
    "hi": "केवल संदर्भ के लिए; सरकारी राजपत्र/आदेश या अपने डीडीओ से सत्यापित करें।"
  },
  "phrases": [
    {
      "id": "om-undersigned-directed",
      "kind": "opening",
      "appliesTo": [
        "office-memorandum",
        "circular"
      ],
      "text": {
        "en": "The undersigned is directed to refer to this Department's O.M. No. {number} dated {date} on the subject cited above and to say that",
        "hi": "अधोहस्ताक्षरी को इस विभाग के कार्यालय ज्ञापन संख्या {number} दिनांक {date} का संदर्भ लेने तथा यह कहने का निदेश हुआ है कि"
      },
      "tags": [
        "reference",
        "third-person"
      ],
      "csmopRef": "Appendix 8.1",
      "source": {
        "name": "केंद्रीय सचिवालय कार्यालय प्रक्रिया नियमावली, 2022 (16वाँ संस्करण), प्रशासनिक सुधार और लोक शिकायत विभाग",
        "url": "https://www.darpg.gov.in/static/uploads/2025/10/8b5d6eb6c7c47bc69e271e25f1c2cc43.pdf",
        "reference": "CSMOP 2022, sixteenth edition (Hindi issue)",
        "dated": "2022-08-05"
      },
      "fetchedAt": "2026-09-03T00:00:00Z",
      "verify": false
    },
    {
      "id": "om-undersigned-say",
      "kind": "opening",
      "appliesTo": [
        "office-memorandum",
        "circular"
      ],
      "text": {
        "en": "The undersigned is directed to say that",
        "hi": "अधोहस्ताक्षरी को यह कहने का निदेश हुआ है कि"
      },
      "tags": [
        "third-person"
      ],
      "csmopRef": "Appendix 8.1, 9.2(iii)",
      "source": {
        "name": "केंद्रीय सचिवालय कार्यालय प्रक्रिया नियमावली, 2022 (16वाँ संस्करण), प्रशासनिक सुधार और लोक शिकायत विभाग",
        "url": "https://www.darpg.gov.in/static/uploads/2025/10/8b5d6eb6c7c47bc69e271e25f1c2cc43.pdf",
        "reference": "CSMOP 2022, sixteenth edition (Hindi issue)",
        "dated": "2022-08-05"
      },
      "fetchedAt": "2026-09-03T00:00:00Z",
      "verify": false
    },
    {
      "id": "om-clarify",
      "kind": "opening",
      "appliesTo": [
        "office-memorandum",
        "circular"
      ],
      "text": {
        "en": "Doubts have been expressed whether the provisions of {rule} also apply to {case}. It is hereby clarified that",
        "hi": "संदेह व्यक्त किया गया है कि क्या {rule} के प्रावधान {case} पर भी लागू होते हैं। एतद्द्वारा यह स्पष्ट किया जाता है कि"
      },
      "tags": [
        "clarification"
      ],
      "csmopRef": "Appendix 8.1",
      "source": {
        "name": "केंद्रीय सचिवालय कार्यालय प्रक्रिया नियमावली, 2022 (16वाँ संस्करण), प्रशासनिक सुधार और लोक शिकायत विभाग",
        "url": "https://www.darpg.gov.in/static/uploads/2025/10/8b5d6eb6c7c47bc69e271e25f1c2cc43.pdf",
        "reference": "CSMOP 2022, sixteenth edition (Hindi issue)",
        "dated": "2022-08-05"
      },
      "fetchedAt": "2026-09-03T00:00:00Z",
      "verify": false
    },
    {
      "id": "letter-with-reference",
      "kind": "opening",
      "appliesTo": [
        "letter",
        "rti-reply",
        "ta-bill-cover"
      ],
      "text": {
        "en": "With reference to your letter No. {number} dated {date} on the subject cited above, I am directed to say that",
        "hi": "ऊपर उद्धृत विषय पर आपके दिनांक {date} के पत्र क्रमांक {number} के संदर्भ में, मुझे यह कहने का निदेश हुआ है कि"
      },
      "tags": [
        "reference",
        "first-person"
      ],
      "csmopRef": "Appendix 8.1",
      "source": {
        "name": "केंद्रीय सचिवालय कार्यालय प्रक्रिया नियमावली, 2022 (16वाँ संस्करण), प्रशासनिक सुधार और लोक शिकायत विभाग",
        "url": "https://www.darpg.gov.in/static/uploads/2025/10/8b5d6eb6c7c47bc69e271e25f1c2cc43.pdf",
        "reference": "CSMOP 2022, sixteenth edition (Hindi issue)",
        "dated": "2022-08-05"
      },
      "fetchedAt": "2026-09-03T00:00:00Z",
      "verify": false
    },
    {
      "id": "letter-in-continuation",
      "kind": "opening",
      "appliesTo": [
        "letter",
        "office-memorandum",
        "circular"
      ],
      "text": {
        "en": "In continuation of this Department's letter No. {number} dated {date}",
        "hi": "हमारे/इस विभाग के पत्र क्रमांक {number} दिनांक {date} के क्रम में"
      },
      "tags": [
        "reference"
      ],
      "csmopRef": "Appendix 8.1",
      "source": {
        "name": "केंद्रीय सचिवालय कार्यालय प्रक्रिया नियमावली, 2022 (16वाँ संस्करण), प्रशासनिक सुधार और लोक शिकायत विभाग",
        "url": "https://www.darpg.gov.in/static/uploads/2025/10/8b5d6eb6c7c47bc69e271e25f1c2cc43.pdf",
        "reference": "CSMOP 2022, sixteenth edition (Hindi issue)",
        "dated": "2022-08-05"
      },
      "fetchedAt": "2026-09-03T00:00:00Z",
      "verify": false
    },
    {
      "id": "letter-correspondence-resting",
      "kind": "opening",
      "appliesTo": [
        "letter"
      ],
      "text": {
        "en": "With reference to the correspondence resting with your letter No. {number} dated {date}",
        "hi": "आपके/इस विभाग के पत्र संख्या {number} दिनांक {date} के पत्राचार के संदर्भ में"
      },
      "tags": [
        "reference"
      ],
      "csmopRef": "Appendix 8.1",
      "source": {
        "name": "केंद्रीय सचिवालय कार्यालय प्रक्रिया नियमावली, 2022 (16वाँ संस्करण), प्रशासनिक सुधार और लोक शिकायत विभाग",
        "url": "https://www.darpg.gov.in/static/uploads/2025/10/8b5d6eb6c7c47bc69e271e25f1c2cc43.pdf",
        "reference": "CSMOP 2022, sixteenth edition (Hindi issue)",
        "dated": "2022-08-05"
      },
      "fetchedAt": "2026-09-03T00:00:00Z",
      "verify": false
    },
    {
      "id": "do-propose",
      "kind": "opening",
      "appliesTo": [
        "demi-official"
      ],
      "text": {
        "en": "We propose to draw up a model scheme for {subject}; a copy of the outline prepared in this connection is enclosed.",
        "hi": "हम {subject} के लिए एक मॉडल योजना तैयार करने का प्रस्ताव करते हैं, इस संबंध में तैयार की गई रूपरेखा की प्रति संलग्न है।"
      },
      "tags": [
        "first-person",
        "active-voice"
      ],
      "csmopRef": "Appendix 8.1",
      "source": {
        "name": "केंद्रीय सचिवालय कार्यालय प्रक्रिया नियमावली, 2022 (16वाँ संस्करण), प्रशासनिक सुधार और लोक शिकायत विभाग",
        "url": "https://www.darpg.gov.in/static/uploads/2025/10/8b5d6eb6c7c47bc69e271e25f1c2cc43.pdf",
        "reference": "CSMOP 2022, sixteenth edition (Hindi issue)",
        "dated": "2022-08-05"
      },
      "fetchedAt": "2026-09-03T00:00:00Z",
      "verify": false
    },
    {
      "id": "do-i-notice",
      "kind": "opening",
      "appliesTo": [
        "demi-official"
      ],
      "text": {
        "en": "I notice that",
        "hi": "मैं देख रहा/रही हूँ कि"
      },
      "tags": [
        "first-person",
        "active-voice"
      ],
      "note": {
        "en": "CSMOP 9.5(i) asks for 'I notice' rather than 'It is noticed' in a demi-official letter.",
        "hi": "सीएसएमओपी 9.5(i) के अनुसार अर्ध-सरकारी पत्र में 'यह देखा गया है' के स्थान पर 'मैं देख रहा/रही हूँ' लिखा जाए।"
      },
      "csmopRef": "9.5(i)",
      "source": {
        "name": "केंद्रीय सचिवालय कार्यालय प्रक्रिया नियमावली, 2022 (16वाँ संस्करण), प्रशासनिक सुधार और लोक शिकायत विभाग",
        "url": "https://www.darpg.gov.in/static/uploads/2025/10/8b5d6eb6c7c47bc69e271e25f1c2cc43.pdf",
        "reference": "CSMOP 2022, sixteenth edition (Hindi issue)",
        "dated": "2022-08-05"
      },
      "fetchedAt": "2026-09-03T00:00:00Z",
      "verify": false
    },
    {
      "id": "do-seek-cooperation",
      "kind": "opening",
      "appliesTo": [
        "demi-official"
      ],
      "text": {
        "en": "I seek your cooperation in the matter of {subject}.",
        "hi": "{subject} के मामले में मैं आपके सहयोग का आकांक्षी/आकांक्षिणी हूँ।"
      },
      "tags": [
        "first-person",
        "active-voice"
      ],
      "csmopRef": "9.5(i)",
      "source": {
        "name": "केंद्रीय सचिवालय कार्यालय प्रक्रिया नियमावली, 2022 (16वाँ संस्करण), प्रशासनिक सुधार और लोक शिकायत विभाग",
        "url": "https://www.darpg.gov.in/static/uploads/2025/10/8b5d6eb6c7c47bc69e271e25f1c2cc43.pdf",
        "reference": "CSMOP 2022, sixteenth edition (Hindi issue)",
        "dated": "2022-08-05"
      },
      "fetchedAt": "2026-09-03T00:00:00Z",
      "verify": false
    },
    {
      "id": "id-note-advice",
      "kind": "opening",
      "appliesTo": [
        "id-note"
      ],
      "text": {
        "en": "The present rules regulating {subject} provide, inter alia, that",
        "hi": "{subject} को विनियमित करने वाले वर्तमान नियमों में अन्य बातों के साथ-साथ यह है कि"
      },
      "tags": [
        "third-person"
      ],
      "csmopRef": "Appendix 8.1",
      "source": {
        "name": "केंद्रीय सचिवालय कार्यालय प्रक्रिया नियमावली, 2022 (16वाँ संस्करण), प्रशासनिक सुधार और लोक शिकायत विभाग",
        "url": "https://www.darpg.gov.in/static/uploads/2025/10/8b5d6eb6c7c47bc69e271e25f1c2cc43.pdf",
        "reference": "CSMOP 2022, sixteenth edition (Hindi issue)",
        "dated": "2022-08-05"
      },
      "fetchedAt": "2026-09-03T00:00:00Z",
      "verify": false
    },
    {
      "id": "id-note-question",
      "kind": "opening",
      "appliesTo": [
        "id-note",
        "noting"
      ],
      "text": {
        "en": "A question has now arisen whether",
        "hi": "अब प्रश्न यह उठता है कि क्या"
      },
      "csmopRef": "Appendix 8.1",
      "source": {
        "name": "केंद्रीय सचिवालय कार्यालय प्रक्रिया नियमावली, 2022 (16वाँ संस्करण), प्रशासनिक सुधार और लोक शिकायत विभाग",
        "url": "https://www.darpg.gov.in/static/uploads/2025/10/8b5d6eb6c7c47bc69e271e25f1c2cc43.pdf",
        "reference": "CSMOP 2022, sixteenth edition (Hindi issue)",
        "dated": "2022-08-05"
      },
      "fetchedAt": "2026-09-03T00:00:00Z",
      "verify": false
    },
    {
      "id": "endorsement-copy",
      "kind": "endorsement",